{
  "entity_aliases": {
    "pm modi": "narendra modi",
    "prime minister modi": "narendra modi",
    "pm": "prime minister",
    "rbi": "reserve bank of india",
    "mha": "ministry of home affairs",
    "mea": "ministry of external affairs",
    "mof": "ministry of finance",
    "mohfw": "ministry of health and family welfare",
    "moe": "ministry of education",
    "mod": "ministry of defence",
    "ec": "election commission of india",
    "eci": "election commission of india",
    "sc": "supreme court of india",
    "niti": "niti aayog",
    "isro": "isro",
    "drdo": "drdo",
    "uic": "union public service commission",
    "upsc": "union public service commission",
    "central bank": "reserve bank of india",
    "the central bank": "reserve bank of india",
    "mpc": "reserve bank of india"
  },
  "ministries": [
    "ministry of agriculture and farmers welfare",
    "ministry of ayush",
    "ministry of chemicals and fertilizers",
    "ministry of civil aviation",
    "ministry of coal",
    "ministry of commerce and industry",
    "ministry of communications",
    "ministry of consumer affairs, food and public distribution",
    "ministry of corporate affairs",
    "ministry of culture",
    "ministry of defence",
    "ministry of development of north east region",
    "ministry of earth sciences",
    "ministry of education",
    "ministry of electronics and information technology",
    "ministry of environment, forest and climate change",
    "ministry of external affairs",
    "ministry of finance",
    "ministry of fisheries, animal husbandry and dairying",
    "ministry of food processing industries",
    "ministry of health and family welfare",
    "ministry of heavy industries",
    "ministry of home affairs",
    "ministry of housing and urban affairs",
    "ministry of information and broadcasting",
    "ministry of jal shakti",
    "ministry of labour and employment",
    "ministry of law and justice",
    "ministry of micro, small and medium enterprises",
    "ministry of mines",
    "ministry of minority affairs",
    "ministry of new and renewable energy",
    "ministry of panchayati raj",
    "ministry of parliamentary affairs",
    "ministry of petroleum and natural gas",
    "ministry of ports, shipping and waterways",
    "ministry of power",
    "ministry of railways",
    "ministry of road transport and highways",
    "ministry of rural development",
    "ministry of science and technology",
    "ministry of skill development and entrepreneurship",
    "ministry of social justice and empowerment",
    "ministry of statistics and programme implementation",
    "ministry of steel",
    "ministry of textiles",
    "ministry of tourism",
    "ministry of tribal affairs",
    "ministry of women and child development",
    "ministry of youth affairs and sports"
  ],
  "agencies": [
    "niti aayog",
    "reserve bank of india",
    "sebi",
    "trai",
    "npci",
    "election commission of india",
    "press information bureau",
    "india meteorological department",
    "imd",
    "ndma",
    "ndrf",
    "icmr",
    "cbi",
    "enforcement directorate",
    "nia",
    "national testing agency",
    "union public service commission",
    "upsc",
    "cbse",
    "ugc",
    "cag",
    "narcotics control bureau",
    "ncert",
    "cvc",
    "doordarshan",
    "prasar bharati",
    "union cabinet",
    "rbi",
    "isro",
    "drdo"
  ],
  "states": [
    "andhra pradesh",
    "arunachal pradesh",
    "assam",
    "bihar",
    "chhattisgarh",
    "goa",
    "gujarat",
    "haryana",
    "himachal pradesh",
    "jharkhand",
    "karnataka",
    "kerala",
    "madhya pradesh",
    "maharashtra",
    "manipur",
    "meghalaya",
    "mizoram",
    "nagaland",
    "odisha",
    "punjab",
    "rajasthan",
    "sikkim",
    "tamil nadu",
    "telangana",
    "tripura",
    "uttar pradesh",
    "uttarakhand",
    "west bengal"
  ],
  "union_territories": [
    "delhi",
    "jammu and kashmir",
    "ladakh",
    "puducherry",
    "chandigarh",
    "andaman and nicobar islands",
    "lakshadweep",
    "dadra and nagar haveli and daman and diu"
  ],
  "major_cities": [
    "new delhi",
    "mumbai",
    "kolkata",
    "chennai",
    "bengaluru",
    "hyderabad",
    "ahmedabad",
    "pune",
    "jaipur",
    "lucknow",
    "kanpur",
    "nagpur",
    "indore",
    "bhopal",
    "visakhapatnam",
    "patna",
    "vadodara",
    "ghaziabad",
    "ludhiana",
    "agra",
    "nashik",
    "ranchi",
    "meerut",
    "surat",
    "rajkot",
    "varanasi",
    "srinagar",
    "amritsar",
    "guwahati",
    "bhubaneswar",
    "kochi",
    "coimbatore",
    "madurai",
    "vijayawada",
    "warangal",
    "mysuru",
    "tiruchirappalli",
    "thiruvananthapuram",
    "gurugram",
    "noida",
    "faridabad",
    "chandigarh",
    "dehradun",
    "shimla",
    "panaji",
    "itanagar",
    "dispur",
    "imphal",
    "agartala",
    "aizawl",
    "kohima",
    "gangtok",
    "shillong",
    "port blair"
  ],
  "india_signals": [
    "india",
    "indian",
    "indians",
    "india's",
    "government of india",
    "pm modi",
    "narendra modi",
    "parliament",
    "lok sabha",
    "rajya sabha",
    "prime minister",
    "ministry of",
    "reserve bank",
    "sebi",
    "trai",
    "isro",
    "imd",
    "election commission",
    "niti aayog",
    "supreme court of india",
    "rupee",
    "indian economy",
    "delhi",
    "mumbai",
    "bengaluru",
    "gst",
    "aadhaar",
    "upi",
    "bharat",
    "indigenous"
  ],
  "international_context_terms": [
    "g20",
    "brics",
    "quad",
    "saarc",
    "united nations",
    "un security council",
    "india-china",
    "india-pakistan",
    "india-us",
    "india-russia",
    "india-eu",
    "lac",
    "loc",
    "chinese troops",
    "galwan",
    "siachen",
    "kashmir",
    "foreign secretary",
    "ambassador",
    "consulate",
    "diaspora",
    "visa policy",
    "trade agreement",
    "fta",
    "sanctions"
  ],
  "people_roles": [
    "narendra modi",
    "pm modi",
    "prime minister modi",
    "prime minister narendra modi",
    "prime minister",
    "president of india",
    "droupadi murmu",
    "vice president",
    "jagdeep dhankhar",
    "rahul gandhi",
    "priyanka gandhi",
    "sonia gandhi",
    "amit shah",
    "rajnath singh",
    "nirmala sitharaman",
    "subrahmanyam jaishankar",
    "arvind kejriwal",
    "mamata banerjee",
    "nitish kumar",
    "m k stalin",
    "pinarayi vijayan",
    "y s jagan mohan reddy",
    "k chandrashekar rao",
    "devendra fadnavis",
    "uddhav thackeray",
    "election commissioner",
    "chief election commissioner",
    "finance minister",
    "home minister",
    "defence minister",
    "railway minister",
    "external affairs minister",
    "chief justice of india",
    "cji",
    "rbi governor",
    "governor of the reserve bank of india",
    "chief minister",
    "lok sabha speaker",
    "attorney general of india"
  ],
  "companies": [
    "reliance",
    "reliance industries",
    "jio",
    "reliance jio",
    "airtel",
    "bharti airtel",
    "vodafone idea",
    "tata",
    "tata group",
    "tata motors",
    "tata steel",
    "tata consultancy services",
    "tcs",
    "infosys",
    "wipro",
    "hcl",
    "tech mahindra",
    "mahindra",
    "mahindra & mahindra",
    "state bank of india",
    "sbi",
    "hdfc",
    "hdfc bank",
    "icici",
    "icici bank",
    "axis bank",
    "kotak",
    "kotak mahindra",
    "bajaj",
    "bajaj auto",
    "bajaj finance",
    "adani",
    "adani group",
    "maruti suzuki",
    "maruti",
    "ongc",
    "indian oil",
    "bharat petroleum",
    "bpcl",
    "hindustan petroleum",
    "hpcl",
    "larsen & toubro",
    "l&t",
    "godrej",
    "asian paints",
    "sun pharma",
    "dr reddy's",
    "cipla",
    "paytm",
    "phonepe",
    "zerodha",
    "swiggy",
    "zomato",
    "ola",
    "irctc",
    "air india",
    "vistara",
    "spicejet",
    "dmart",
    "tata power"
  ],
  "false_positive_phrases": [
    "indian wells",
    "indian summer",
    "indian ocean",
    "india ink",
    "indian pale ale",
    "india pale ale",
    "american indian",
    "native american",
    "west indies",
    "indianapolis",
    "indiana",
    "indian territory"
  ]
}
